<?xml version="1.0" encoding="UTF-8"?>
<!DOCTYPE agent SYSTEM "../../../../config/dtd/agent.dtd">
<agent xmlns:proto="http://botlab.dev/protocol" dtd_version="1.0">
    <metadata>
        <name>test_filter</name>
        <type category="foundation">filter</type>
        <version>1.0</version>
        <timing>
            <response_interval unit="seconds">30</response_interval>
        </timing>
    </metadata>
    
    <protocols>
        <protocol id="test_proto">
            <agent_definition>
                <objectives>
                    <primary>Test objective</primary>
                    <secondary>Test secondary objective</secondary>
                </objectives>
                <style>
                    <communication>Test communication style</communication>
                    <analysis>Test analysis style</analysis>
                </style>
            </agent_definition>
        </protocol>
    </protocols>
    
    <momentum>
        <sequence id="test_seq" type="test" proto:ref="test_proto" temperature="0.7">
            <message position="1">
                <role type="system"/>
                <content>Test message</content>
            </message>
        </sequence>
    </momentum>
    
    <filters>
        <filter type="mention" username="test_bot"/>
        <filter type="topic" topic="test_topic"/>
        <filter type="rate_limit" interval="60"/>
    </filters>
</agent> 