<?xml version="1.0" encoding="UTF-8"?>
<!DOCTYPE agent SYSTEM "../../../../config/dtd/agent.dtd">
<agent dtd_version="1.0">
    <metadata>
        <name>Momentum Test Agent</name>
        <type category="test">Test Type</type>
        <version>1.0</version>
        <timing>
            <response_interval unit="seconds">1</response_interval>
        </timing>
    </metadata>
    <protocols>
        <protocol id="test_proto">
            <agent_definition>
                <objectives>
                    <primary>Test objective</primary>
                    <secondary>Test secondary</secondary>
                </objectives>
                <style>
                    <communication>Test communication</communication>
                    <analysis>Test analysis</analysis>
                </style>
            </agent_definition>
        </protocol>
    </protocols>
    <momentum>
        <sequence id="init" type="initialization" protocol_ref="test_proto" temperature="0.7">
            <message position="1">
                <role type="system"/>
                <content>System initialization message</content>
            </message>
            <message position="2">
                <role type="assistant"/>
                <content>Assistant initialization response</content>
            </message>
        </sequence>
        <sequence id="recovery" type="recovery" protocol_ref="test_proto" temperature="0.8">
            <message position="1">
                <role type="system"/>
                <content>Recovery prompt</content>
            </message>
        </sequence>
    </momentum>
</agent> 