<?xml version="1.0" encoding="UTF-8"?>
<!DOCTYPE agent SYSTEM "../../../../config/dtd/agent.dtd">
<agent xmlns:proto="http://botlab.dev/protocol" dtd_version="1.0">
    <metadata>
        <name>Test Sequence Chain Agent</name>
        <type category="test">Test Type</type>
        <version>1.0</version>
        <timing>
            <response_interval unit="seconds">1</response_interval>
        </timing>
    </metadata>

    <protocols>
        <protocol id="test_proto">
            <agent_definition>
                <objectives>
                    <primary>Test objective</primary>
                    <secondary>Test secondary objective</secondary>
                </objectives>
                <style>
                    <communication>Test communication style</communication>
                    <analysis>Test analysis style</analysis>
                </style>
            </agent_definition>
        </protocol>
    </protocols>

    <momentum>
        <sequence id="init" type="initialization" proto:ref="test_proto" temperature="0.7">
            <message position="1">
                <role type="system"/>
                <content>Start initialization</content>
            </message>
        </sequence>
        
        <sequence id="greeting" type="greeting" proto:ref="test_proto" temperature="0.8">
            <message position="1">
                <role type="system"/>
                <content>Hello</content>
            </message>
        </sequence>
        
        <sequence id="analysis" type="analysis" proto:ref="test_proto" temperature="0.4">
            <message position="1">
                <role type="system"/>
                <content>Analyze this data</content>
            </message>
        </sequence>
        
        <sequence id="conclusion" type="conclusion" proto:ref="test_proto" temperature="0.6">
            <message position="1">
                <role type="system"/>
                <content>Wrap it up</content>
            </message>
        </sequence>
    </momentum>
</agent> 