<?xml version="1.0" encoding="UTF-8"?>
<!DOCTYPE agent SYSTEM "../../../../config/dtd/agent.dtd">
<agent dtd_version="1.0">
    <metadata>
        <name>Test Agent</name>
        <type category="test">Test Type</type>
        <version>1.0</version>
        <timing>
            <response_interval unit="seconds">1</response_interval>
        </timing>
    </metadata>
    <protocols>
        <protocol id="test">
            <agent_definition>
                <objectives>
                    <primary>Test objective</primary>
                    <secondary>Test secondary</secondary>
                </objectives>
                <style>
                    <communication>Test communication</communication>
                    <analysis>Test analysis</analysis>
                </style>
            </agent_definition>
        </protocol>
    </protocols>
    <momentum>
        <sequence id="test" type="init" protocol_ref="test" temperature="0.7">
            <message position="1">
                <role type="system"/>
                <content>Test message</content>
            </message>
        </sequence>
    </momentum>
</agent> 