<?xml version="1.0" encoding="UTF-8"?>
<!DOCTYPE agent SYSTEM "../../../../config/dtd/agent.dtd">
<agent xmlns:proto="http://botlab.dev/protocol" dtd_version="1.0">
    <metadata>
        <name>Test Protocol Agent</name>
        <type category="test">Test Type</type>
        <version>1.0</version>
        <timing>
            <response_interval unit="seconds">1</response_interval>
        </timing>
        <service>
            <provider>anthropic</provider>
            <model>claude-3-opus-20240229</model>
            <api_version>2024-02-15</api_version>
        </service>
    </metadata>

    <protocols>
        <protocol id="test_proto">
            <agent_definition>
                <objectives>
                    <primary>Test objective</primary>
                    <secondary>Test secondary objective</secondary>
                </objectives>
                <style>
                    <communication>Test communication style</communication>
                    <analysis>Test analysis style</analysis>
                </style>
            </agent_definition>
        </protocol>
    </protocols>

    <momentum>
        <sequence id="init" type="initialization" proto:ref="test_proto" temperature="0.7">
            <message position="1">
                <role type="system"/>
                <content>Test initialization message referencing protocol test_proto</content>
            </message>
        </sequence>
    </momentum>
</agent> 